{
  "schemaVersion": 1,
  "catalogId": "agentswitchboard.external-agent-tooling.v1",
  "capturedDate": "2026-08-16",
  "authority": {
    "governance": "AGENTS.md",
    "harnessDoctrine": "docs/governance/harness-doctrine.md",
    "purpose": "preserve and route external tool/framework/plugin evidence without converting mentions into install authority"
  },
  "policy": {
    "sourceClaimsAreFacts": false,
    "installationAuthorizedByCatalog": false,
    "providerCallsAuthorizedByCatalog": false,
    "networkExecutionAuthorizedByCatalog": false,
    "liveTargetMutationAuthorizedByCatalog": false,
    "requiredEvidenceStates": [
      "reported",
      "partially-verified",
      "verified",
      "unresolved"
    ],
    "requiredDispositions": [
      "existing-reference",
      "evaluate",
      "compatibility",
      "supporting",
      "comparison",
      "watchlist"
    ],
    "adoptionGate": "verify official upstream identity/version, security/privacy/runtime behavior, repository overlap, rollback, and an owned implementation sprint before installation or integration",
    "catalogPresenceProvesInstalled": false,
    "catalogPresenceProvesExecutable": false,
    "catalogPresenceProvesTrusted": false,
    "catalogPresenceProvesPrivate": false,
    "catalogPresenceProvesRuntimeReady": false,
    "capabilityTruthOwner": "CAPABILITIES.md and runtime-specific canonical owners"
  },
  "sourceBuckets": {
    "covered-prior": "Items described as covered before the current catalog request.",
    "user-today": "Items named directly by the operator in the current source conversation.",
    "video-1": "DeepSeek harness architecture notes supplied by the operator.",
    "video-2": "Matt Pocock agent-skill framework notes supplied by the operator.",
    "video-3": "Reverse prompting / Git Reverse notes supplied by the operator.",
    "video-4": "Context-as-variable / recursive-language-model notes supplied by the operator.",
    "video-5": "Graph-memory and related agent framework notes supplied by the operator."
  },
  "reportedClaims": [
    {
      "claimId": "deepseek-prefix-caching-cost",
      "entryId": "deepseek-harness",
      "claim": "The supplied source reports up to 120x operational-cost reduction from immutable append-only context and prefix caching.",
      "evidenceState": "reported",
      "reuseAllowedWithoutVerification": false
    }
  ],
  "entries": [
    {
      "id": "understand-anything",
      "name": "Understand Anything",
      "aliases": [],
      "kind": "plugin",
      "mentionClass": "primary",
      "sourceBucket": "covered-prior",
      "category": "codebase-intelligence",
      "summary": "Reported as a platform-agnostic codebase parser that uses Tree-sitter to build local interactive knowledge graphs.",
      "evidenceState": "reported",
      "verificationRequiredBeforeAdoption": true,
      "disposition": "evaluate",
      "integrationAuthority": "none",
      "capabilityState": "unknown",
      "runtimeProof": "unproved",
      "trustProof": "unproved",
      "privacyProof": "unproved"
    },
    {
      "id": "colibri",
      "name": "Colibri",
      "aliases": [],
      "kind": "inference-engine",
      "mentionClass": "primary",
      "sourceBucket": "covered-prior",
      "category": "local-inference",
      "summary": "Reported as a C-based local inference engine designed to stream large mixture-of-experts parameters from SSD without requiring a GPU.",
      "evidenceState": "reported",
      "verificationRequiredBeforeAdoption": true,
      "disposition": "evaluate",
      "integrationAuthority": "none",
      "capabilityState": "unknown",
      "runtimeProof": "unproved",
      "trustProof": "unproved",
      "privacyProof": "unproved"
    },
    {
      "id": "opencode",
      "name": "OpenCode",
      "aliases": [],
      "kind": "coding-agent",
      "mentionClass": "primary",
      "sourceBucket": "covered-prior",
      "category": "coding-agent",
      "summary": "Terminal-oriented coding assistant already referenced by AgentSwitchboard workflows and operator usage.",
      "evidenceState": "reported",
      "verificationRequiredBeforeAdoption": true,
      "disposition": "existing-reference",
      "integrationAuthority": "none",
      "capabilityState": "unknown",
      "runtimeProof": "unproved",
      "trustProof": "unproved",
      "privacyProof": "unproved"
    },
    {
      "id": "chatgpt",
      "name": "ChatGPT",
      "aliases": [],
      "kind": "ai-platform",
      "mentionClass": "primary",
      "sourceBucket": "covered-prior",
      "category": "agent-platform",
      "summary": "AI platform named as part of the operator's current multi-agent workflow.",
      "evidenceState": "reported",
      "verificationRequiredBeforeAdoption": true,
      "disposition": "compatibility",
      "integrationAuthority": "none",
      "capabilityState": "unknown",
      "runtimeProof": "unproved",
      "trustProof": "unproved",
      "privacyProof": "unproved"
    },
    {
      "id": "anti-gravity",
      "name": "Anti-gravity",
      "aliases": [
        "Antigravity"
      ],
      "kind": "ai-platform",
      "mentionClass": "primary",
      "sourceBucket": "covered-prior",
      "category": "agent-platform",
      "summary": "AI platform name supplied by the operator; exact product identity remains unresolved.",
      "evidenceState": "unresolved",
      "verificationRequiredBeforeAdoption": true,
      "disposition": "watchlist",
      "integrationAuthority": "none",
      "capabilityState": "unknown",
      "runtimeProof": "unproved",
      "trustProof": "unproved",
      "privacyProof": "unproved"
    },
    {
      "id": "cursor",
      "name": "Cursor",
      "aliases": [],
      "kind": "coding-agent",
      "mentionClass": "compatibility",
      "sourceBucket": "covered-prior",
      "category": "coding-agent",
      "summary": "Coding environment named for compatibility context.",
      "evidenceState": "reported",
      "verificationRequiredBeforeAdoption": true,
      "disposition": "compatibility",
      "integrationAuthority": "none",
      "capabilityState": "unknown",
      "runtimeProof": "unproved",
      "trustProof": "unproved",
      "privacyProof": "unproved"
    },
    {
      "id": "github-copilot",
      "name": "GitHub Copilot",
      "aliases": [],
      "kind": "coding-agent",
      "mentionClass": "compatibility",
      "sourceBucket": "covered-prior",
      "category": "coding-agent",
      "summary": "Coding assistant named for compatibility context.",
      "evidenceState": "reported",
      "verificationRequiredBeforeAdoption": true,
      "disposition": "compatibility",
      "integrationAuthority": "none",
      "capabilityState": "unknown",
      "runtimeProof": "unproved",
      "trustProof": "unproved",
      "privacyProof": "unproved"
    },
    {
      "id": "codex",
      "name": "Codex",
      "aliases": [],
      "kind": "coding-agent",
      "mentionClass": "compatibility",
      "sourceBucket": "covered-prior",
      "category": "coding-agent",
      "summary": "Coding agent/platform named for compatibility context.",
      "evidenceState": "reported",
      "verificationRequiredBeforeAdoption": true,
      "disposition": "compatibility",
      "integrationAuthority": "none",
      "capabilityState": "unknown",
      "runtimeProof": "unproved",
      "trustProof": "unproved",
      "privacyProof": "unproved"
    },
    {
      "id": "gemini-cli",
      "name": "Gemini CLI",
      "aliases": [],
      "kind": "coding-agent",
      "mentionClass": "compatibility",
      "sourceBucket": "covered-prior",
      "category": "coding-agent",
      "summary": "Command-line agent named for compatibility context.",
      "evidenceState": "reported",
      "verificationRequiredBeforeAdoption": true,
      "disposition": "compatibility",
      "integrationAuthority": "none",
      "capabilityState": "unknown",
      "runtimeProof": "unproved",
      "trustProof": "unproved",
      "privacyProof": "unproved"
    },
    {
      "id": "gcc",
      "name": "GCC",
      "aliases": [],
      "kind": "compiler",
      "mentionClass": "supporting",
      "sourceBucket": "covered-prior",
      "category": "supporting-toolchain",
      "summary": "Compiler toolchain referenced for compatibility with native/local tooling.",
      "evidenceState": "reported",
      "verificationRequiredBeforeAdoption": true,
      "disposition": "supporting",
      "integrationAuthority": "none",
      "capabilityState": "unknown",
      "runtimeProof": "unproved",
      "trustProof": "unproved",
      "privacyProof": "unproved"
    },
    {
      "id": "tree-sitter",
      "name": "Tree-sitter",
      "aliases": [],
      "kind": "parser-framework",
      "mentionClass": "supporting",
      "sourceBucket": "covered-prior",
      "category": "codebase-intelligence",
      "summary": "Parser framework named as the parsing substrate in the Understand Anything claim.",
      "evidenceState": "reported",
      "verificationRequiredBeforeAdoption": true,
      "disposition": "supporting",
      "integrationAuthority": "none",
      "capabilityState": "unknown",
      "runtimeProof": "unproved",
      "trustProof": "unproved",
      "privacyProof": "unproved"
    },
    {
      "id": "unsloth",
      "name": "Unsloth",
      "aliases": [],
      "kind": "fine-tuning-framework",
      "mentionClass": "primary",
      "sourceBucket": "user-today",
      "category": "model-training",
      "summary": "Reported as a highly optimized framework for fast, memory-efficient fine-tuning of large language models.",
      "evidenceState": "reported",
      "verificationRequiredBeforeAdoption": true,
      "disposition": "evaluate",
      "integrationAuthority": "none",
      "capabilityState": "unknown",
      "runtimeProof": "unproved",
      "trustProof": "unproved",
      "privacyProof": "unproved"
    },
    {
      "id": "deepseek-harness",
      "name": "DeepSeek Harness",